{
  "schema_version": 1,
  "identity": {
    "full_name": "Ravi Ranjan Prasad",
    "headline": "Full Stack Chatbot Developer | Generative AI & Backend Engineer",
    "location": "Faridabad, Delhi NCR, India",
    "tagline": "Six years building enterprise conversational AI and the high-concurrency backend services behind it."
  },
  "summary": "Full Stack Chatbot Developer and AI Engineer with 6+ years of experience designing, developing and supporting enterprise conversational AI applications and high-concurrency backend services. Experienced in building Generative AI assistants end to end, including LLM integration, prompt engineering, Retrieval-Augmented Generation (RAG), knowledge retrieval and conversation-state management. Strong backend expertise in Python (FastAPI), Node.js, REST APIs, MongoDB, Redis and microservices, with hands-on experience deploying applications on Microsoft Azure (App Service, Azure Functions) and implementing GitHub Actions CI/CD pipelines. Experienced in integrating enterprise platforms including ServiceNow (Incident Management, Knowledge Base, Service Catalog), Genesys Live Chat, and multi-tenant architecture with Microsoft Teams, Zoom and Google Chat, along with application monitoring, performance optimization, production troubleshooting and zero-downtime deployments.",
  "skills": [
    {
      "category": "Languages",
      "items": [
        "JavaScript",
        "TypeScript",
        "Python",
        "SQL"
      ]
    },
    {
      "category": "Backend & Frameworks",
      "items": [
        "Node.js",
        "NestJS",
        "Express",
        "FastAPI",
        "REST API design",
        "Microsoft Bot Framework",
        "Microservices",
        "Asynchronous processing"
      ]
    },
    {
      "category": "Generative AI / Conversational AI",
      "items": [
        "LLM integration (Azure OpenAI, GPT-4.1 & mini)",
        "Prompt engineering",
        "RAG pipelines",
        "Vector search and embeddings",
        "Agentic / multi-turn dialogue design",
        "Intent handling, fallback and escalation logic",
        "Chatbot evaluation metrics"
      ]
    },
    {
      "category": "Cloud & DevOps",
      "items": [
        "Microsoft Azure (App Service, Azure Functions, Azure OpenAI, Azure AI Search, Cosmos DB, Application Insights, Key Vault)",
        "CI/CD pipeline design",
        "GitHub Actions",
        "Azure DevOps Pipelines",
        "Docker",
        "Git",
        "Blue-green and zero-downtime deployments"
      ]
    },
    {
      "category": "Databases & Caching",
      "items": [
        "MongoDB",
        "Cosmos DB",
        "Redis",
        "Query optimization",
        "Indexing",
        "Caching strategy"
      ]
    },
    {
      "category": "Enterprise Integrations",
      "items": [
        "ServiceNow (Incident/Ticketing, Knowledge Base, Interactions, Service Catalog)",
        "Genesys Live Chat",
        "Microsoft Teams",
        "Zoom API",
        "Azure AD authentication",
        "Webhooks"
      ]
    },
    {
      "category": "Practices",
      "items": [
        "Agile / Scrum",
        "Code reviews",
        "Unit and integration testing",
        "Observability and logging",
        "Production support",
        "Technical documentation",
        "Knowledge transfer"
      ]
    }
  ],
  "experience": [
    {
      "employer": "Tata Consultancy Services (TCS)",
      "role": "Full Stack Chatbot Developer / AI Backend Engineer",
      "start": "2021-10",
      "end": "Present",
      "summary": "Building and supporting enterprise conversational AI backends for global IT support, most recently the ExxonMobil Enterprise AI Assistant (ITChat).",
      "clients": [
        {
          "name": "Exxon Mobil Corporation",
          "project": "Enterprise AI Assistant (ITChat)",
          "start": "2024-09",
          "end": "Present",
          "summary": "Enterprise Generative AI assistant for global IT support.",
          "highlights": [
            "Developed and maintained backend services for an enterprise Generative AI assistant using Python (FastAPI) and Node.js, supporting high-concurrency conversational workloads for global IT support.",
            "Engineered GenAI workflows covering LLM integration, prompt engineering, response grounding, conversation context/state management, and fallback handling for low-confidence responses.",
            "Designed and enhanced Retrieval-Augmented Generation (RAG) pipelines over enterprise knowledge sources such as policy documents, IT runbooks and knowledge base articles, including document chunking, embedding refresh, retrieval optimization and relevance tuning.",
            "Integrated ServiceNow REST APIs for incident creation, ticket status lookup and service catalog requests, enabling IT transactions directly through Microsoft Teams.",
            "Deployed backend services on Microsoft Azure (App Service, Azure Functions) and implemented GitHub Actions CI/CD for automated build, test and deployment workflows.",
            "Implemented Azure Application Insights telemetry and optimized application performance through caching, query tuning and asynchronous processing, monitoring latency, error rates and fallback behavior.",
            "Collaborated with QA teams and client stakeholders across UAT, production releases, defect resolution and post-release validation."
          ]
        },
        {
          "name": "Shell plc",
          "project": "IT Support Chatbot (Sam)",
          "start": "2021-10",
          "end": "2024-09",
          "summary": "Enterprise IT support chatbot across Web and Microsoft Teams.",
          "highlights": [
            "Developed and enhanced an enterprise IT support chatbot using Microsoft Bot Framework and Node.js, supporting multi-turn conversations, context retention, Adaptive Cards and fallback handling across Web and Microsoft Teams.",
            "Implemented Natural Language Processing (NLP) capabilities using Azure Conversational Language Understanding (CLU) to identify user intent and route customer utterances to appropriate chatbot flows.",
            "Trained and maintained Azure CLU models using customer utterances, supporting intent recognition and conversational routing for IT support scenarios.",
            "Integrated ServiceNow Incident/Ticketing, Knowledge Base and Interactions with Genesys Live Chat, enabling automated support workflows and bot-to-agent escalation.",
            "Developed and maintained REST APIs and backend services, including MongoDB query optimization and Redis caching for session and frequently accessed data.",
            "Implemented structured logging, environment-specific configuration and secret management to improve application traceability and operational support.",
            "Collaborated with client product owners to translate support requirements into conversational flows and used containment and escalation metrics to identify chatbot improvement areas.",
            "Supported production troubleshooting and root-cause analysis, resolving live defects and implementing permanent fixes."
          ]
        }
      ],
      "highlights": []
    },
    {
      "employer": "Wipro",
      "role": "Associate Software Engineer",
      "start": "2019-06",
      "end": "2020-06",
      "summary": "Enterprise Asset Management - AIRFORCE INDIA (IAF-Maximo) & Core Integration Stream (IBF-AIC).",
      "highlights": [
        "Supported IBM Maximo Enterprise Asset Management (EAM) platform using Java-based application components and SQL/MySQL databases for large-scale asset tracking and maintenance operations.",
        "Optimized SQL queries and database operations, troubleshooting performance issues, resolving data integrity problems and improving reliability of backend data processing.",
        "Contributed to Maximo application development and maintenance, including defect resolution, application enhancements and backend troubleshooting across enterprise workflows.",
        "Supported system integration validation across Maximo and connected enterprise applications, analyzing data flows, identifying integration defects and validating fixes.",
        "Participated in Agile development sprints, collaborating with development and QA teams on requirements, implementation, testing, defect resolution and production-ready releases."
      ]
    }
  ],
  "projects": [],
  "education": [
    {
      "degree": "B.Tech, Computer Science & Engineering",
      "institution": "Chandigarh University, Mohali",
      "start": "2015",
      "end": "2019"
    }
  ],
  "certifications": [
    {
      "name": "Microsoft Certified: Azure Fundamentals (AZ-900)",
      "issuer": "Microsoft",
      "source": "resume p.2 CERTIFICATIONS & ACHIEVEMENTS"
    },
    {
      "name": "Microsoft Certified: Azure AI Fundamentals (AI-901)",
      "issuer": "Microsoft",
      "source": "resume p.2 CERTIFICATIONS & ACHIEVEMENTS"
    },
    {
      "name": "Claude Certified Architect - Foundations",
      "issuer": "Anthropic",
      "source": "resume p.2 CERTIFICATIONS & ACHIEVEMENTS"
    },
    {
      "name": "Claude Certified Developer - Foundations",
      "issuer": "Anthropic",
      "source": "resume p.2 CERTIFICATIONS & ACHIEVEMENTS"
    },
    {
      "name": "Tech 4.0 Certified Professional",
      "issuer": "Tata Consultancy Services",
      "note": "TCS internal competency framework",
      "source": "resume p.2 CERTIFICATIONS & ACHIEVEMENTS"
    },
    {
      "name": "Certification training in Linux Administration and Networking Fundamentals",
      "source": "resume p.2 CERTIFICATIONS & ACHIEVEMENTS"
    },
    {
      "name": "Multiple TCS Digital Awards and client appreciation certificates for project delivery",
      "issuer": "Tata Consultancy Services",
      "source": "resume p.2 CERTIFICATIONS & ACHIEVEMENTS"
    }
  ],
  "contact": {
    "email": {
      "value": "ravi1996.r@gmail.com",